Date,Source,Headline,Sentiment,Sentiment Score,Label,Link
2024-08-27,Crypto Daily,"Hot Memecoin Alert! Shiba Inu’s ($SHIB) Best Friend, Husky Inu ($HINU)",Negative,0.3933,4 stars,https://cryptodaily.co.uk/2024/08/hot-memecoin-alert-shiba-inus-shib-best-friend-husky-inu-hinu
2024-08-27,Crypto Daily,Telegram's Coins Drop After Pavel Durov's Arrest - Watch Top 3 Bullish Solana Memecoins That Could Surprise You,Negative,0.3536,2 stars,https://cryptodaily.co.uk/2024/08/telegrams-coins-drop-after-pavel-durovs-arrest-watch-top-3-bullish-solana-memecoins-that-could-surprise-you
2024-08-27,Crypto Daily,Russia Gears Up for Crypto-Based Trade Trials Amid Sanctions,Negative,0.3235,2 stars,https://cryptodaily.co.uk/2024/08/russia-gears-up-for-crypto-based-trade-trials-amid-sanctions
2024-08-27,Crypto Daily,Legion Raises $2M for Merit-Based ICO Platform,Negative,0.3089,4 stars,https://cryptodaily.co.uk/2024/08/legion-raises-2m-for-merit-based-ico-platform
2024-08-27,Crypto Daily,MapleStory Universe Unveils Nexpace Protocol Today,Negative,0.3067,4 stars,https://cryptodaily.co.uk/2024/08/maplestory-universe-unveils-nexpace-protocol-today
2024-08-27,Crypto Daily,SSV Network and Ether.fi Launch Learn & Earn Campaign to Raise Awareness of Liquid Restaking,Negative,0.3705,4 stars,https://cryptodaily.co.uk/2024/08/ssv-network-and-etherfi-launch-learn-earn-campaign-to-raise-awareness-of-liquid-restaking
2024-08-27,Crypto Daily,"Crypto Price Analysis 8-27 BTC, ETH, SOL, WIF, DOT, TIA, AVAX, TON",Negative,0.3765,2 stars,https://cryptodaily.co.uk/2024/08/crypto-price-analysis-8-27-btc-eth-sol-wif-dot-tia-avax-ton
2024-08-27,Crypto Daily,Top 5 IDO/ICO Launchpads to Watch in 2024,Negative,0.4871,5 stars,https://cryptodaily.co.uk/2024/08/top-5-idoico-launchpads-to-watch-in-2024
2024-08-27,Crypto Daily,How AI Is Helping To Make iGaming Safer Than Ever,Negative,0.3829,5 stars,https://cryptodaily.co.uk/2024/08/how-ai-is-helping-to-make-igaming-safer-than-ever
2024-08-27,Crypto Daily,"RepubliK Introduces Creator STOX, Ushering in a New Era of SocialFi",Negative,0.3388,5 stars,https://cryptodaily.co.uk/2024/08/republik-introduces-creator-stox-ushering-in-a-new-era-of-socialfi
2024-08-27,Crypto Daily,SEC Secures Settlement from Abra in Unregistered Securities Case,Positive,0.5642,1 stars,https://cryptodaily.co.uk/2024/08/sec-secures-settlement-from-abra-in-unregistered-securities-case
2024-08-27,Crypto Daily,"Memecoins $PEPE, $WIF, $BRETT reversing downtrend - everything now depends on $BTC",Negative,0.3206,2 stars,https://cryptodaily.co.uk/2024/08/memecoins-pepe-wif-brett-reversing-downtrend-everything-now-depends-on-btc
2024-08-27,Crypto Daily,Bitcoin (BTC) rebound incoming,Negative,0.3435,4 stars,https://cryptodaily.co.uk/2024/08/bitcoin-btc-rebound-incoming
2024-08-27,Crypto Daily,Slash Payments Token SLV To List On Gate.io Exchange Following Exclusive Airdrop,Negative,0.26,4 stars,https://cryptodaily.co.uk/2024/08/slash-payments-token-slv-to-list-on-gateio-exchange-following-exclusive-airdrop
2024-08-26,Crypto Daily,This is How to Double Your Investment Portfolio by the Year’s End - These 5 Coins You Need,Negative,0.3509,4 stars,https://cryptodaily.co.uk/2024/08/this-is-how-to-double-your-investment-portfolio-by-the-years-end-these-5-coins-you-need
2024-08-26,Crypto Daily,"$1,000 Invested in This Meme Coin Could Grow into $100,000 by the End of 2024, Claims Legendary Analyst",Negative,0.3323,4 stars,https://cryptodaily.co.uk/2024/08/1000-invested-in-this-meme-coin-could-grow-into-100000-by-the-end-of-2024-claims-legendary-analyst
2024-08-26,Crypto Daily,What’s Next for Toncoin and Notcoin After the Founder’s Arrest? Also Watch 3 Altcoins Poised for Big Moves,Negative,0.3649,2 stars,https://cryptodaily.co.uk/2024/08/whats-next-for-toncoin-and-notcoin-after-the-founders-arrest-also-watch-3-altcoins-poised-for-big-moves
2024-08-26,Crypto Daily,New Cryptocurrency Base Dawgz Hits $3M Milestone In Presale - Next 100x Meme Coin?,Negative,0.2884,2 stars,https://cryptodaily.co.uk/2024/08/new-cryptocurrency-base-dawgz-hits-3m-milestone-in-presale-next-100x-meme-coin
2024-08-26,Crypto Daily,Experts Highlight Cardano (ADA) and MoonTaurus (MNTR) as Key Players in the 2024 Bull Run,Negative,0.4153,4 stars,https://cryptodaily.co.uk/2024/08/experts-highlight-cardano-ada-and-moontaurus-mntr-as-key-players-in-the-2024-bull-run
2024-08-26,Crypto Daily,Solana (SOL) manoeuvres into pole position ready for bull market surge,Negative,0.3487,2 stars,https://cryptodaily.co.uk/2024/08/solana-sol-manoeuvres-into-pole-position-ready-for-bull-market-surge
2024-08-26,Crypto Daily,"Experts See Bitcoin Breaking $70,000 — 5 Altcoins Poised for 1000% Growth on the Next Green Candle",Negative,0.2382,2 stars,https://cryptodaily.co.uk/2024/08/experts-see-bitcoin-breaking-70000-5-altcoins-poised-for-1000-growth-on-the-next-green-candle
2024-08-26,Crypto Daily,10 Best Cryptos to Buy Now As Bitcoin Price Recovers,Negative,0.358,4 stars,https://cryptodaily.co.uk/2024/08/10-best-cryptos-to-buy-now-as-bitcoin-price-recovers
2024-08-26,Crypto Daily,LBank Makes a Grand Statement at Coinfest Asia 2024 with Spectacular Car Showcase,Negative,0.2912,4 stars,https://cryptodaily.co.uk/2024/08/lbank-makes-a-grand-statement-at-coinfest-asia-2024-with-spectacular-car-showcase
2024-08-26,Crypto Daily,Warden announces the Artificial Intelligence Blockchain Interface (AIBI),Negative,0.251,4 stars,https://cryptodaily.co.uk/2024/08/warden-announces-the-artificial-intelligence-blockchain-interface-aibi
2024-08-26,Crypto Daily,"Bitcoin (BTC) holds above $63,000 - next bullish phase to come",Negative,0.4145,1 stars,https://cryptodaily.co.uk/2024/08/bitcoin-btc-holds-above-63000-next-bullish-phase-to-come
2024-08-26,Crypto Daily,"Avalanche (AVAX) Climbs 24% This Week, Experts Are Eyeing This New Altcoin For High Returns",Negative,0.3362,4 stars,https://cryptodaily.co.uk/2024/08/avalanche-avax-climbs-24-this-week-experts-are-eyeing-this-new-altcoin-for-high-returns
2024-08-26,Crypto Daily,A Developer’s Mindset: Top Blockchain Hackathons To Attend In Q4 2024,Negative,0.3554,4 stars,https://cryptodaily.co.uk/2024/08/a-developers-mindset-top-blockchain-hackathons-to-attend-in-q4-2024
2024-08-26,Crypto Daily,"Crypto Price Analysis 8-26 BTC, ETH, SOL, DOGE, DOT, XRP, SEI",Negative,0.3654,2 stars,https://cryptodaily.co.uk/2024/08/crypto-price-analysis-8-26-btc-eth-sol-doge-dot-xrp-sei
2024-08-26,Crypto Daily,Bybit Powered by SATOS Marks a New Chapter in the Netherlands with the Grand Opening of  New Amsterdam Office,Negative,0.3549,5 stars,https://cryptodaily.co.uk/2024/08/bybit-powered-by-satos-marks-a-new-chapter-in-the-netherlands-with-the-grand-opening-of-new-amsterdam-office
2024-08-26,Crypto Daily,Relax and Let Your Husky Inu ($HINU) Grow!,Negative,0.4087,4 stars,https://cryptodaily.co.uk/2024/08/relax-and-let-your-husky-inu-hinu-grow
2024-08-26,Crypto Daily,Polkadot Reimagines Ethereum 2.0 as JAM Upgrade Gets Up to Speed,Negative,0.2971,2 stars,https://cryptodaily.co.uk/2024/08/polkadot-reimagines-ethereum-20-as-jam-upgrade-gets-up-to-speed
2024-08-26,Crypto Daily,FSL Launches Super Useless Token ($SUT): The Studio’s First Meme Coin on Polygon PoS,Negative,0.3521,4 stars,https://cryptodaily.co.uk/2024/08/fsl-launches-super-useless-token-sut-the-studios-first-meme-coin-on-polygon-pos
2024-08-26,Crypto Daily,LBank Bali Web3 Future Night Unites Web3 Innovators for a Memorable Evening,Negative,0.304,4 stars,https://cryptodaily.co.uk/2024/08/lbank-bali-web3-future-night-unites-web3-innovators-for-a-memorable-evening
2024-08-23,Crypto Daily,"Long-Time Shiba Inu Whale Diversifies Portfolio, Accumulates 'Next Big Meme Coin' After 100% Move",Negative,0.3653,5 stars,https://cryptodaily.co.uk/2024/08/long-time-shiba-inu-whale-diversifies-portfolio-accumulates-next-big-meme-coin-after-100-move
2024-08-25,Crypto Daily,"Polkadot Price Analysis: $DOT Gains 10%, Nears $5 Mark",Negative,0.3121,2 stars,https://cryptodaily.co.uk/2024/08/polkadot-price-analysis-dot-gains-10-nears-5-mark
2024-08-25,Crypto Daily,Experience Potential Memecoin Greatness with Husky Inu ($HINU),Negative,0.4002,2 stars,https://cryptodaily.co.uk/2024/08/experience-potential-memecoin-greatness-with-husky-inu-hinu
2024-08-25,Crypto Daily,Crypto Trader’s Guide To Life Insurance Benefits,Negative,0.3774,4 stars,https://cryptodaily.co.uk/2024/08/crypto-traders-guide-to-life-insurance-benefits
2024-08-23,Crypto Daily,"Analyst Who Hasn’t Been Wrong Since 2021 Calls Cardano (ADA) a Crapshoot, Predicts 2000% Bull Move for Trending Dogecoin (DOGE) Rival",Negative,0.3037,2 stars,https://cryptodaily.co.uk/2024/08/analyst-who-hasnt-been-wrong-since-2021-calls-cardano-ada-a-crapshoot-predicts-2000-bull-move-for-trending-dogecoin-doge-rival
2024-08-25,Crypto Daily,Explore These Ambitious Memecoins Before Making Your Investment - x25 Potential For Next Month,Negative,0.248,2 stars,https://cryptodaily.co.uk/2024/08/explore-these-ambitious-memecoins-before-making-your-investment-x25-potential-for-next-month
2024-08-25,Crypto Daily,"Crypto Weekly Roundup: Trump's DeFiant DeFi, MakerDAO Endgame, & More",Negative,0.3373,1 stars,https://cryptodaily.co.uk/2024/08/crypto-weekly-roundup-trumps-defiant-defi-makerdao-endgame-more
2024-08-23,Crypto Daily,Meme Coin Whale Dumps PEPE and Shiba Inu (SHIB) for MoonTaurus (MNTR) After Seeing Major Presale Momentum,Negative,0.3752,4 stars,https://cryptodaily.co.uk/2024/08/meme-coin-whale-dumps-pepe-and-shiba-inu-shib-for-moontaurus-mntr-after-seeing-major-presale-momentum
2024-08-23,Crypto Daily,This Crypto Trader Accurately Predicted the Rise of Shiba Inu (SHIB) and Pepe (PEPE); Here’s His Next 100x Meme Coin,Negative,0.3452,4 stars,https://cryptodaily.co.uk/2024/08/this-crypto-trader-accurately-predicted-the-rise-of-shiba-inu-shib-and-pepe-pepe-heres-his-next-100x-meme-coin
2024-08-24,Crypto Daily,"Bulls Are Back: Ripple's New Bank Connections, Bitcoin's Momentum and 3 Coins Indicate Explosive Growth",Negative,0.2634,4 stars,https://cryptodaily.co.uk/2024/08/bulls-are-back-ripples-new-bank-connections-bitcoins-momentum-and-3-coins-indicate-explosive-growth
2024-08-24,Crypto Daily,"Solana Superstar Husky Inu ($HINU) Raises Over $370,000 in Early Presale",Negative,0.3636,4 stars,https://cryptodaily.co.uk/2024/08/solana-superstar-husky-inu-hinu-raises-over-370000-in-early-presale
2024-08-24,Crypto Daily,Watch Next Week’s Top 5 Altcoins With Potential for Massive Profits,Negative,0.352,4 stars,https://cryptodaily.co.uk/2024/08/watch-next-weeks-top-5-altcoins-with-potential-for-massive-profits
2024-08-23,Crypto Daily,Dogecoin vs MoonTaurus: Which Coin Should You Choose For the Long Term Gains?,Negative,0.4809,4 stars,https://cryptodaily.co.uk/2024/08/dogecoin-vs-moontaurus-which-coin-should-you-choose-for-the-long-term-gains
2024-09-04,cryptodnes,Каква може да е причината зад понижението на цената на Solana (SOL)?,Negative,0.3453,2 stars,https://cryptodnes.bg/kakva-moje-prichinata-zad-ponijenieto-cenata-solana-sol/
2024-09-04,cryptodnes,Защо меме монетите превземат крипто света,Negative,0.3889,1 stars,https://cryptodnes.bg/zashto-meme-monetite-prevzemat-kripto-sveta/
2024-09-04,cryptodnes,Артът Хейс коригира прогнозата си за Биткойн и очерта най-лошия сценарии за цената,Negative,0.3925,1 stars,https://cryptodnes.bg/arthur-hayes-korigira-prognozata-bitcoin-ocherta-nai-loshiq-scenarii-cenata/
2024-09-04,cryptodnes,"Ето как този трейдър спечели $670,000 от нова крипто платформа",Negative,0.3839,1 stars,https://cryptodnes.bg/eto-kak-tozi-treidur-specheli-670000-ot-nova-kripto-platforma/
2024-09-04,cryptodnes,Conflux мрежата обяви партньорство с Alibaba,Negative,0.2749,3 stars,https://cryptodnes.bg/conflux-mrejata-obyavi-partniorstvo-s-alibaba/
2024-09-04,cryptodnes,Етериум изпревари Биткойн по този показател,Negative,0.3436,2 stars,https://cryptodnes.bg/ethereum-zasenchi-bitcoin-po-tozi-pokazatel/
2024-09-04,cryptodnes,DeFi протокол загуби $27 милиона при пробив в сигурността,Positive,0.504,1 stars,https://cryptodnes.bg/defi-protokol-gubi-27-miliona-pri-probiv-v-sigurnostta/
2024-09-04,cryptodnes,БРИКС: ЕС изрази загриженост относно кандидатурата на Турция,Negative,0.4066,1 stars,https://cryptodnes.bg/brics-es-izrazi-zagrijenost-otnosno-kandidaturata-turciq/
2024-09-04,cryptodnes,Крипто китовете се възползват от движенията в цената на Биткойн,Negative,0.3379,1 stars,https://cryptodnes.bg/kripto-kitovete-vuzpolzvat-dvijeniqta-cenata-bitcoin/
2024-09-04,cryptodnes,"Още една голяма банка влиза в надпреварата, пускайки собствени крипто услуги",Negative,0.3952,1 stars,https://cryptodnes.bg/oshte-edna-golqma-banka-vliza-nadprevarata-puskaiki-sobstveni-kripto-uslugi/
2024-09-04,Crypto-Economist,How Cryptocurrency Could Alter The Outcome Of The US Presidential Election,Negative,0.2901,3 stars,https://en.cryptonomist.ch/2024/09/04/how-crypto-could-alter-outcome-us-presidential-election/
2024-09-04,Crypto-Economist,Floki Announces Partnership with OG Esports for Valhalla Metaverse Game,Negative,0.39,4 stars,https://en.cryptonomist.ch/2024/09/04/floki-announces-partnership-with-og-esports-for-valhalla-metaverse-game/
2024-09-04,Crypto-Economist,Cardano better than Bitcoin? The statements of Charles Hoskinson and the criticisms of the crypto community,Negative,0.2813,4 stars,https://en.cryptonomist.ch/2024/09/04/cardano-better-than-bitcoin-the-statements-of-charles-hoskinson-and-the-criticisms-of-the-crypto-community/
2024-09-04,Crypto-Economist,Crypto Whales Buy Bitcoin During The Dip And This New Meme Coin ICO,Negative,0.2566,3 stars,https://en.cryptonomist.ch/2024/09/04/crypto-whales-buy-bitcoin-during-the-dip-and-this-new-meme-coin-ico/
2024-09-04,Crypto-Economist,21Shares launches 21BTC to disrupt the WBTC market on Ethereum,Negative,0.3679,4 stars,https://en.cryptonomist.ch/2024/09/04/21shares-launches-21btc-to-disrupt-the-wbtc-market-on-ethereum/
2024-09-04,Crypto-Economist,Zurich: the SKB bank ventures into the crypto world by introducing trading and custody services for Bitcoin and Ethereum,Negative,0.2729,4 stars,https://en.cryptonomist.ch/2024/09/04/zurich-the-skb-bank-ventures-into-the-crypto-world-by-introducing-trading-and-custody-services-for-bitcoin-and-ethereum/
2024-09-04,Crypto-Economist,Crypto scam with Bitcoin ATM: 110 million dollars in losses in 2023,Negative,0.4998,1 stars,https://en.cryptonomist.ch/2024/09/04/crypto-scam-with-bitcoin-atm-110-million-dollars-in-losses-in-2023/
2024-09-04,Crypto-Economist,JPMorgan: the profitability of bitcoin mining is at an all-time low,Negative,0.3441,2 stars,https://en.cryptonomist.ch/2024/09/04/jpmorgan-the-profitability-of-bitcoin-mining-is-at-an-all-time-low/
2024-09-04,Crypto-Economist,Dogecoin: some positive forecasts on the price of DOGE,Negative,0.306,3 stars,https://en.cryptonomist.ch/2024/09/04/dogecoin-some-positive-forecasts-on-the-price-of-doge/
2024-09-04,Crypto-Economist,Sui revolutionizes access to crypto with radio waves: offline cryptography arrives even outside banks,Negative,0.2927,2 stars,https://en.cryptonomist.ch/2024/09/04/sui-revolutionizes-access-to-crypto-with-radio-waves-offline-cryptography-arrives-even-outside-banks/
2024-09-04,Cryptopolitan,"CFTC fines Uniswap $175,000 for illegal leveraged trading",Negative,0.462,1 stars,https://www.cryptopolitan.com/cftc-fines-uniswap-175000-leveraged-trading/
2024-09-04,Cryptopolitan,NaNoWriMo faces intense criticism for supporting AI,Negative,0.3485,1 stars,https://www.cryptopolitan.com/nanowrimo-faces-intense-criticism/
2024-09-04,Cryptopolitan,Anthropic’s Claude Enterprise emerges as top competitor to ChatGPT in AI for big business,Negative,0.3359,4 stars,https://www.cryptopolitan.com/anthropics-claude-enterprise-chatgpt/
2024-09-04,Cryptopolitan,UK regulators clear Microsoft-Inflection AI deal after competition review,Negative,0.2783,2 stars,https://www.cryptopolitan.com/uk-regulators-microsoft-inflection-ai-deal/
2024-09-04,Cryptopolitan,Riot Games adjusts regional pricing for virtual currency across all its live titles,Negative,0.2995,4 stars,https://www.cryptopolitan.com/riot-games-adjusts-pricing-virtual-currency/
2024-09-04,Cryptopolitan,OpenAI Japan’s CEO reveals upcoming GPT-Next model to be 100 times more powerful,Negative,0.4068,4 stars,https://www.cryptopolitan.com/openai-japans-ceo-reveals-gpt-next-model/
2024-09-04,Cryptopolitan,Bank of Canada cuts interest rates again,Negative,0.3361,1 stars,https://www.cryptopolitan.com/bank-of-canada-cuts-interest-rates-again/
2024-09-04,Cryptopolitan,X resolves data dispute with Europe’s Data Protection Commission,Negative,0.3618,1 stars,https://www.cryptopolitan.com/x-resolves-data-dispute-with-europe-dpc/
2024-09-04,Cryptopolitan,Sony secures exclusive marketing rights for GTA 6 on PlayStation,Negative,0.331,4 stars,https://www.cryptopolitan.com/sony-exclusive-marketing-rights-for-gta-6-on/
2024-09-04,Cryptopolitan,Tether’s new initiative aims to boost crypto literacy in Indonesia through a ten-city tour,Negative,0.3347,4 stars,https://www.cryptopolitan.com/tether-initiative-crypto-literacy-indonesia/
2024-09-04,Crypto-Potato,Penpie DeFi Platform Reportedly Hit With $27 Million Security Breach,Negative,0.4762,1 stars,https://cryptopotato.com/penpie-defi-platform-reportedly-hit-with-27-million-security-breach/
2024-09-04,Crypto-Potato,Donald Trump Relatives’ X Accounts Hacked to Promote Fake Crypto Token,Positive,0.6117,1 stars,https://cryptopotato.com/donald-trump-relatives-x-accounts-hacked-to-promote-fake-crypto-token/
2024-09-04,Crypto-Potato,Cantor Fitzgerald CEO: Bitcoin Dipping its Toe into Global Finance,Negative,0.2841,1 stars,https://cryptopotato.com/cantor-fitzgerald-ceo-bitcoin-dipping-its-toe-into-global-finance/
2024-09-04,Crypto-Potato,BC.GAME Unveils Brand Upgrade to Enhance Its iGaming Platform,Negative,0.4198,5 stars,https://cryptopotato.com/bc-game-unveils-brand-upgrade-to-enhance-its-igaming-platform/
2024-09-04,Crypto-Potato,Floki Announces Partnership with OG Esports for Valhalla Metaverse Game,Negative,0.4585,4 stars,https://cryptopotato.com/floki-announces-partnership-with-og-esports-for-valhalla-metaverse-game/
2024-09-04,Crypto-Potato,Bitcoin Price Recovers Above $58K: Bear Trap Confirmed?,Negative,0.4501,1 stars,https://cryptopotato.com/bitcoin-price-recovers-above-58k-bear-trap-confirmed/
2024-09-04,Crypto-Potato,Binance to Temporarily Suspend Deposits and Withdrawals on BNB Smart Chain Soon: Here’s Why,Negative,0.2931,2 stars,https://cryptopotato.com/binance-to-temporarily-suspend-deposits-and-withdrawals-on-bnb-smart-chain-soon-heres-why/
2024-09-04,Crypto-Potato,Is Ethereum (ETH) on the Verge of a ‘Big Breakout?’ (Analysts Weigh in),Negative,0.3375,2 stars,https://cryptopotato.com/is-ethereum-eth-on-the-verge-of-a-big-breakout-analysts-weigh-in/
2024-09-04,Crypto-Potato,Pro-Ripple (XRP) Lawyer John Deaton Will Face Off Against Dem Sen Elizabeth Warren,Negative,0.3392,4 stars,https://cryptopotato.com/pro-ripple-xrp-lawyer-john-deaton-will-face-off-against-dem-sen-elizabeth-warren/
2024-09-04,Crypto-Potato,Pepe Unchained Presale Nears $12M Milestone as Analyst Says it Could be the Next Top Meme Coin,Negative,0.2661,1 stars,https://cryptopotato.com/pepe-unchained-presale-nears-12m-milestone-as-analyst-says-it-could-be-the-next-top-meme-coin/
2024-09-05,CryptoTimes,Bank of Canada Cuts Interest Rates: What Does It Mean for Bitcoin?,Negative,0.4113,1 stars,https://www.cryptotimes.io/2024/09/05/bank-of-canada-cuts-interest-rates-what-does-it-mean-for-bitcoin/
2024-09-04,CryptoTimes,SEC Delays Decision to Approve Eco-friendly Bitcoin ETF,Negative,0.4354,1 stars,https://www.cryptotimes.io/2024/09/05/sec-delays-decision-to-approve-eco-friendly-bitcoin-etf/
2024-09-04,CryptoTimes,Bitfarms Responds to Riot Platforms’ Criticism Over Board Changes,Negative,0.4872,1 stars,https://www.cryptotimes.io/2024/09/05/bitfarms-responds-to-riot-platforms-criticism-over-board-changes/
2024-09-04,CryptoTimes,Sam Altman Leads $10 Million Initiative for  U.S. AI Infrastructure,Negative,0.3011,4 stars,https://www.cryptotimes.io/2024/09/05/sam-altman-leads-10-million-initiative-for-u-s-ai-infrastructure/
2024-09-04,CryptoTimes,Binance Adds Grant Thornton as New Accounting Advisor,Negative,0.3582,4 stars,https://www.cryptotimes.io/2024/09/05/binance-adds-grant-thornton-as-new-accounting-advisor/
2024-09-04,CryptoTimes,Euler Finance Launches New Credit Layer After Past Security Breach,Negative,0.3067,4 stars,https://www.cryptotimes.io/2024/09/04/euler-finance-launches-new-credit-layer-after-past-security-breach/
2024-09-04,CryptoTimes,Uniswap Labs Hit with $175K Fine by CFTC for DeFi Violations,Negative,0.4508,1 stars,https://www.cryptotimes.io/2024/09/04/uniswap-labs-hit-with-175k-fine-by-cftc-for-defi-violations/
2024-09-04,CryptoTimes,BC.GAME Unveils Brand Upgrade to Enhance Its iGaming Platform,Negative,0.4109,4 stars,https://www.cryptotimes.io/2024/09/04/bc-game-unveils-brand-upgrade-to-enhance-its-igaming-platform/
2024-09-04,CryptoTimes,Floki Announces Partnership with OG Esports for Valhalla Metaverse Game,Negative,0.4651,4 stars,https://www.cryptotimes.io/2024/09/04/floki-announces-partnership-with-og-esports-for-valhalla-metaverse-game/
2024-09-04,CryptoTimes,Sui Blockchain Develops “Internet-Less” Crypto Transactions,Negative,0.349,4 stars,https://www.cryptotimes.io/2024/09/04/sui-blockchain-develops-internet-less-crypto-transactions/
2024-09-04,Dailycoin,Polygon’s MATIC to POL Upgrade Goes Live: What Changes and What’s Next?,Negative,0.2634,1 stars,https://dailycoin.com/polygons-matic-to-pol-upgrade-goes-live-what-changes-and-whats-next/
2024-09-04,Dailycoin,Crypto Market Tumbles as Nvidia Faces DOJ Antitrust Probe,Negative,0.4705,1 stars,https://dailycoin.com/crypto-market-tumbles-as-nvidia-faces-doj-antitrust-probe/
2024-09-04,Dailycoin,What’s Behind Solana’s Recent Volatility After Whale Sell-off?,Negative,0.3651,1 stars,https://dailycoin.com/whats-behind-solanas-recent-volatility-after-whale-sell-off/
2024-09-04,Dailycoin,Bitcoin Sinks to 27-Day Low: What Caused the Drop?,Negative,0.46,1 stars,https://dailycoin.com/bitcoin-sinks-to-27-day-low-what-caused-the-drop/
2024-09-04,Dailycoin,Cramer Sparks Bitcoin Rebound Optimism with Pessimistic Tweet,Negative,0.4439,1 stars,https://dailycoin.com/cramer-sparks-bitcoin-rebound-optimism-with-pessimistic-tweet/
2024-09-04,Dailycoin,UPDATED: “It’s a Lie!”: Gambaryan Cries Out as 2nd Bail Hearing Ends in Deadlock,Negative,0.4413,1 stars,https://dailycoin.com/breaking-gambaryans-second-bail-hearing-ends-in-deadlock/
2024-09-04,Dailycoin,Trump Family Accounts Hacked to Push Fake World Liberty Token,Positive,0.6276,1 stars,https://dailycoin.com/trump-family-accounts-hacked-to-push-fake-world-liberty-token/
2024-09-04,Dailycoin,Terra’s Do Kwon Moves $62M in Bitcoin Ahead of U.S. Case Hearing,Positive,0.5012,1 stars,https://dailycoin.com/terras-do-kwon-moves-62m-in-bitcoin-ahead-of-u-s-case-hearing/
2024-09-04,Dailycoin,Why Samsung Joined Sony in Betting Big on Startale Labs,Negative,0.2854,1 stars,https://dailycoin.com/why-samsung-joined-sony-in-betting-big-on-startale-labs/
2024-09-04,Dailycoin,SEC Has No Clear Path for Ripple Appeal as Deadline Approaches,Negative,0.4563,1 stars,https://dailycoin.com/sec-has-no-clear-path-for-ripple-appeal-as-deadline-approaches/
2024-09-05,Daily-Hodl,"Crypto Trader Predicts Breakout Rally for FET, Updates Outlook on WIF and Two Additional Altcoins",Negative,0.3367,1 stars,https://dailyhodl.com/2024/09/04/crypto-trader-predicts-breakout-rally-for-fet-updates-outlook-on-wif-and-two-additional-altcoins/
2024-09-04,Daily-Hodl,Donald Trump’s Crypto Project Says Mission To Spread US-Pegged Stablecoins Throughout the World,Negative,0.2775,1 stars,https://dailyhodl.com/2024/09/04/donald-trumps-crypto-project-says-mission-to-spread-us-pegged-stablecoins-throughout-the-world/
2024-09-04,Daily-Hodl,"Willy Woo Updates Bitcoin Outlook, Says Bearish Chapter for BTC Moving to New Phase",Negative,0.2715,2 stars,https://dailyhodl.com/2024/09/04/willy-woo-updates-bitcoin-outlook-says-bearish-chapter-for-btc-moving-to-new-phase/
2024-09-04,Daily-Hodl,"Markets Expecting Bearish September – Making It Less Likely To Happen, Say Glassnode Founders",Negative,0.2898,1 stars,https://dailyhodl.com/2024/09/04/markets-expecting-bearish-september-making-it-less-likely-to-happen-say-glassnode-founders/
2024-09-04,Daily-Hodl,"Crypto Exchange Hacker Moves $6,500,000 in Ethereum (ETH) to Digital Asset Mixer Tornado Cash: PeckShield",Positive,0.5212,1 stars,https://dailyhodl.com/2024/09/04/crypto-exchange-hacker-moves-6500000-in-ethereum-eth-to-digital-asset-mixer-tornado-cash-peckshield/
2024-09-04,Daily-Hodl,CFTC Issues Order Against Uniswap Labs for Allegedly Offering Illegal Digital Asset Derivatives Trading,Positive,0.5114,1 stars,https://dailyhodl.com/2024/09/04/cftc-issues-order-against-uniswap-labs-for-allegedly-offering-illegal-digital-asset-derivatives-trading/
2024-09-04,Daily-Hodl,Two Ethereum-Based DeFi Altcoins Spark Sudden Rallies After Whale Purchases: On-Chain Data,Negative,0.3829,1 stars,https://dailyhodl.com/2024/09/04/two-ethereum-based-defi-altcoins-spark-sudden-rallies-after-whale-purchases-on-chain-data/
