Date,Source,Headline,Sentiment,Sentiment Score,Label,Link
2024-09-04,Daily-Hodl,"Ripple Chief Legal Officer Blasts SEC, Says Regulator Fabricated ‘Crypto Asset Security’ Term",Negative,0.4584,1 stars,https://dailyhodl.com/2024/09/04/ripple-chief-legal-officer-blasts-sec-says-regulator-fabricated-crypto-asset-security-term/
2024-09-04,Daily-Hodl,"Former St. Louis Fed President Says Soft Landing Has Been Achieved, Predicts Multiple Rate Cuts This Year",Negative,0.2567,2 stars,https://dailyhodl.com/2024/09/04/former-st-louis-fed-president-says-soft-landing-has-been-achieved-predicts-multiple-rate-cuts-this-year/
2024-09-04,Daily-Hodl,"One Bitcoin Investor Cohort Unloads More Than $36,400,000,000 in BTC in Less Than a Month, According to Analyst",Negative,0.43,1 stars,https://dailyhodl.com/2024/09/04/one-bitcoin-investor-cohort-unloads-more-than-36400000000-in-btc-in-less-than-a-month-according-to-analyst/
2024-09-05,Decrypt,Feds Seize Domains Linked to Russian AI Disinformation Campaign,Positive,0.5393,1 stars,https://decrypt.co/247946/russian-ai-disinformation-domains-seized-justice-department
2024-09-04,Decrypt,"Bitcoin Could ‘Slowly Leak’ Toward $50,000 Before Its Next Surge: Arthur Hayes",Negative,0.4296,2 stars,https://decrypt.co/247939/bitcoin-could-slowly-leak-toward-50000-before-its-next-surge-arthur-hayes
2024-09-04,Decrypt,"If You Bought Bored Ape NFTs at the Peak, You’ve Lost 93% of Your Investment",Negative,0.4493,2 stars,https://decrypt.co/247930/if-you-bought-bored-ape-nfts-at-the-peak-youve-lost-93-of-your-investment
2024-09-04,Decrypt,"Telegram Game 'W-Coin' Picks TON for Token After Players Shun Solana, Ethereum",Negative,0.3525,5 stars,https://decrypt.co/247924/telegram-game-w-coin-ton-token-over-solana-ethereum
2024-09-04,Decrypt,OpenAI Co-Founder Ilya Sutskever's Safe AI Startup Raises $1 Billion,Negative,0.492,5 stars,https://decrypt.co/247897/safe-superintelligence-ilya-sutskevers-safe-ai-raises-1-billion
2024-09-04,Decrypt,Bitfarms Bites Back at Riot in Bitcoin Mining Battle,Negative,0.3508,4 stars,https://decrypt.co/247844/bitfarms-bites-back-riot-bitcoin-mining-battle
2024-09-04,Decrypt,Elizabeth Warren to Face Pro-Crypto Lawyer John Deaton in Senate Race,Negative,0.3821,3 stars,https://decrypt.co/247909/elizabeth-warren-face-pro-crypto-lawyer-john-deaton-senate-race
2024-09-04,Decrypt,Elon Musk-Themed Telegram Game 'X Empire' Reveals How Airdrop Tokens Will Be Allocated,Negative,0.4527,4 stars,https://decrypt.co/247900/elon-musk-telegram-game-x-empire-airdrop-tokens-allocated
2024-09-04,Decrypt,Here Are Today's ‘Hamster Kombat’ Daily Combo and Cipher Code,Negative,0.4977,1 stars,https://decrypt.co/resources/todays-hamster-kombat-daily-combo-cipher-code
2024-09-04,Decrypt,Flow Brings World Tour Builder Series to Singapore Following Crescendo Upgrade,Negative,0.455,4 stars,https://decrypt.co/247812/flow-brings-world-tour-builder-series-to-singapore-following-crescendo-upgrade
2024-09-04,Decrypt,"AI Chatbots Have Begun to Create Their Own Culture, Researchers Say",Negative,0.2832,4 stars,https://decrypt.co/247867/ai-chatbots-have-begun-to-create-their-own-culture-researchers-say
2024-09-04,Decrypt,Trump Crypto Project Aims to Maintain US Dollar Supremacy With Stablecoins,Negative,0.2527,4 stars,https://decrypt.co/247865/trump-crypto-project-aims-maintain-us-dollar-supremacy-stablecoins
2024-09-04,Decrypt,Floki Announces Partnership with OG Esports for Valhalla Metaverse Game,Negative,0.4398,1 stars,https://decrypt.co/247880/floki-announces-partnership-with-og-esports-for-valhalla-metaverse-game
2024-09-04,Decrypt,FOMO HOUR 193 - NVIDIA DROPS-OFF,Positive,0.7909,1 stars,https://decrypt.co/videos/interviews/LxNEmmjX/fomo-hour-193-nvidia-drops-off
2024-09-04,Decrypt,Here Are Today’s ‘Rocky Rabbit’ Enigma and SuperSet Daily Combo Solutions,Negative,0.3867,5 stars,https://decrypt.co/resources/here-are-todays-rocky-rabbit-enigma-superset-daily-combo-solutions
2024-09-04,Decrypt,CFTC Issues Order Against Ethereum DeFi Exchange Uniswap,Negative,0.4632,1 stars,https://decrypt.co/247848/cftc-issues-order-against-ethereum-defi-uniswap
2024-09-04,Decrypt,Here Are Today’s ‘X Empire’ Elon Musk Game Daily Combo and Riddle,Negative,0.2335,3 stars,https://decrypt.co/resources/todays-musk-empire-stock-exchange-daily-combo
2024-09-04,Decrypt,"'Nyan Heroes' Returns to Epic Games Store With New Playtest, Solana Token Rewards",Negative,0.4359,4 stars,https://decrypt.co/247739/nyan-heroes-playtest-3-preview-solana-epic-games
2024-09-04,Decrypt,Bitcoin ETFs Shed $288 Million in Fifth Day of Negative Flows,Positive,0.6156,1 stars,https://decrypt.co/247809/bitcoin-etfs-shed-288-million-in-fifth-day-of-negative-flows
2024-09-04,Decrypt,When Are the Next Big Telegram Game Airdrops? From ‘Hamster Kombat’ to ‘Rocky Rabbit’,Negative,0.3895,5 stars,https://decrypt.co/247771/next-telegram-game-airdrops
2024-09-04,Decrypt,DePIN Project Wants to Send Satellites to Space to Give Internet to the Underserved,Negative,0.3948,4 stars,https://decrypt.co/247806/depin-project-satellites-space-internet-underserved
2024-09-04,Decrypt,"Ripple CEO Predicts SEC Chair Gary Gensler’s Exit, Whoever Wins Election",Negative,0.2688,1 stars,https://decrypt.co/247803/ripple-ceo-predicts-sec-chair-gary-genslers-exit-whoever-wins-election
2024-09-04,Decrypt,"Bitcoin Dives Below $56,000 After Stock Market Rout",Positive,0.7854,1 stars,https://decrypt.co/247782/bitcoin-dives-below-56000-after-stock-market-rout
2024-09-04,Decrypt,"What’s Ahead for OpenAI? Project Strawberry, Orion, and GPT Next",Positive,0.6188,5 stars,https://decrypt.co/247769/openai-strawberry-orion-gpt-next
2024-09-04,Decrypt,Why ETF Issuer 21Shares Is Launching a New Wrapped Bitcoin on Ethereum,Negative,0.3877,2 stars,https://decrypt.co/247770/why-etf-issuer-21shares-is-launching-a-new-wrapped-bitcoin-on-ethereum
2024-09-03,Decrypt,Nvidia Market Cap Drop Sets Record as Tech Stocks Fall,Positive,0.529,1 stars,https://decrypt.co/247765/nvidia-market-cap-drops-apple-microsoft-google
2024-09-03,Decrypt,Polygon Is Migrating From MATIC to POL: Here's Everything You Need to Know,Positive,0.5309,5 stars,https://decrypt.co/247763/polygon-matic-pol-migration-september-4
2024-09-03,Decrypt,"Bitcoin Could Go Lower Despite Fed Rate Cuts, Analysts Say",Positive,0.5033,3 stars,https://decrypt.co/247757/bitcoin-could-go-lower-despite-fed-rate-cuts-analysts
2024-09-03,Decrypt,Most TON Holders In the Red as Price Keeps Falling After Telegram CEO Arrest,Negative,0.2327,4 stars,https://decrypt.co/247751/most-ton-holders-in-the-red-as-price-keeps-falling-after-telegram-ceo-arrest
2024-09-03,Decrypt,FBI Warns North Korean Cyber Crooks May Be Targeting Bitcoin ETF Companies,Negative,0.3399,1 stars,https://decrypt.co/247734/fbi-warns-north-korean-cyber-crooks-bitcoin-etfs
2024-09-03,Decrypt,FOMO HOUR 192 - WTF IS ETHERVISTA,Negative,0.3167,1 stars,https://decrypt.co/videos/interviews/xOt72jL2/fomo-hour-192-wtf-is-ethervista
2024-09-03,Decrypt,Bitcoin Miner Riot Calls Out ‘Concerning’ Moves From Bitfarms Amid Attempted Takeover,Negative,0.393,1 stars,https://decrypt.co/247737/bitcoin-miner-riot-concerning-bitfarms-takeover
2024-09-03,Decrypt,SuiPlay0x1 Preview: Everything You Need to Know About the Crypto Gaming Handheld,Negative,0.307,4 stars,https://decrypt.co/225709/suiplay0x1-preview-everything-need-know-crypto-gaming-handheld
2024-09-03,Decrypt,ZKsync Maker Matter Labs Reveals Layoffs Amid Crowded Ethereum Scaling Market,Negative,0.3834,1 stars,https://decrypt.co/247615/zksync-maker-matter-labs-layoffs-ethereum-scaling-crowded
2024-09-03,Decrypt,"Bitcoin Price Is Down, But Hash Rate Just Hit an All-Time High",Positive,0.5397,5 stars,https://decrypt.co/247721/bitcoin-price-down-hash-rate-all-time-high
2024-09-03,Decrypt,‘World’s First Crypto-Themed Immersive Theater’ to Debut at Token2049,Positive,0.5947,5 stars,https://decrypt.co/246982/worlds-first-crypto-themed-immersive-theater-to-debut-at-token2049
2024-09-03,Decrypt,Terra-Linked Galois Capital Lost $40 Million on FTX—Now It Must Pay the SEC a Fine Too,Positive,0.757,1 stars,https://decrypt.co/247618/terra-linked-galois-capital-lost-40-million-ftx-sec-fine
2024-08-31,Decrypt,Dogecoin Millionaire Explains How Neiro United Meme Coins,Negative,0.332,4 stars,https://decrypt.co/videos/interviews/LjhyvMyI/dogecoin-millionaire-explains-how-neiro-united-meme-coins
2024-08-30,Decrypt,FOMO HOUR 191 - CRYPTO STABLE,Positive,0.6254,1 stars,https://decrypt.co/videos/interviews/VM5OAovR/fomo-hour-191-crypto-stable
2024-08-29,Decrypt,FOMO HOUR 190 - OPENSEA VS SEC,Positive,0.7183,1 stars,https://decrypt.co/videos/interviews/g3scPNlK/fomo-hour-190-opensea-vs-sec
2024-08-28,Decrypt,FOMO HOUR 189 - TRUMP LAUNCHES MORE NFTS,Positive,0.6707,1 stars,https://decrypt.co/videos/interviews/xUt5dSH4/fomo-hour-189-trump-launches-more-nfts
2024-08-27,Decrypt,FOMO HOUR 188 - TON CONTINUES TO FALL,Positive,0.6913,1 stars,https://decrypt.co/videos/interviews/UhURASRQ/fomo-hour-188-ton-continues-to-fall
2024-08-26,Decrypt,FOMO HOUR 187 - AI TOKENS LEADING,Positive,0.6998,1 stars,https://decrypt.co/videos/interviews/M7IhK60K/fomo-hour-187-ai-tokens-leading
2024-08-24,Decrypt,The Meme Coin That Became a REAL Religion!,Negative,0.4341,5 stars,https://decrypt.co/videos/interviews/szDuQcIw/the-meme-coin-that-became-a-real-religion
2024-08-23,Decrypt,FOMO HOUR 186 - AVAX LEADS PUMP,Positive,0.6084,1 stars,https://decrypt.co/videos/interviews/JRqyT8vz/fomo-hour-186-avax-leads-pump
2024-08-23,Decrypt,FOMO HOUR 185 - KAMALA 'SUPPORTS' CRYPTO?,Positive,0.757,1 stars,https://decrypt.co/videos/interviews/u48y6NBU/fomo-hour-185-kamala-supports-crypto
2024-08-21,Decrypt,FOMO HOUR 184 - PUNKS ARE FLYING!,Positive,0.6606,1 stars,https://decrypt.co/videos/interviews/ILpzl0Wk/fomo-hour-184-punks-are-flying
2024-08-20,Decrypt,FOMO HOUR 183 - WE ARE NOW SHITCOINING ON TRON,Positive,0.7423,1 stars,https://decrypt.co/videos/interviews/GMxAt3Zm/fomo-hour-183-we-are-now-shitcoining-on-tron
2024-08-20,Decrypt,FOMO HOUR 182 - STABLECOIN CAP NEARS ATH,Positive,0.5068,1 stars,https://decrypt.co/videos/interviews/3IvrurI2/fomo-hour-182-stablecoin-cap-nears-ath
2024-08-17,Decrypt,FOMO HOUR 181 - GIGA HITS $300M,Positive,0.7671,1 stars,https://decrypt.co/videos/interviews/J3XuCSVs/fomo-hour-181-giga-hits-300m
2024-08-15,Decrypt,This Hedge Fund Buys Meme Coins. Here’s Why.,Negative,0.3163,5 stars,https://decrypt.co/videos/interviews/2ONS3oez/this-hedge-fund-buys-meme-coins-heres-why
2024-08-15,Decrypt,"FOMO HOUR 180 - BTC BACK DOWN, AGAIN",Positive,0.7982,1 stars,https://decrypt.co/videos/interviews/sOoU4d0P/fomo-hour-180-btc-back-down-again
2024-08-14,Decrypt,"Shark Tank's Kevin O'Leary Welcomes Crypto Regulation, Slams Celebrity 'Shitcoins'",Negative,0.2955,3 stars,https://decrypt.co/videos/interviews/eLEvriJL/shark-tanks-kevin-oleary-welcomes-crypto-regulation-slams-celebrity-shitcoins
2024-08-14,Decrypt,FOMO HOUR 179 - PUMP FUN STILL RISING!,Positive,0.6758,1 stars,https://decrypt.co/videos/interviews/UUtOYPia/fomo-hour-179-pump-fun-still-rising
2024-08-13,Decrypt,FOMO HOUR 178 - TRUMP AND ELON ON X,Positive,0.7315,1 stars,https://decrypt.co/videos/interviews/8ObLFDks/fomo-hour-178-trump-and-elon-on-x
2024-08-31,GlobalCryptoPress,"It Launched BARELY 1 Year Ago, and PayPal's Stablecoin (PYUSD) Just Surpassed a $1+ Billion Market Cap...",Negative,0.2451,4 stars,https://www.globalcryptopress.com/2024/08/it-launched-barely-1-year-ago-and.html
2024-08-24,GlobalCryptoPress,"Kamala Harris Switching To Pro-Crypto Policies?  One Advisor is Claims It's True, But There's Reason to Remain Skeptical..",Negative,0.2436,3 stars,https://www.globalcryptopress.com/2024/08/kamala-harris-switching-to-pro-crypto.html
2024-08-21,GlobalCryptoPress,AI Presents New Opportunity to Bitcoin Miners...,Negative,0.2858,4 stars,https://www.globalcryptopress.com/2024/08/ai-presents-new-opportunity-to-bitcoin.html
2024-08-21,GlobalCryptoPress,German Authorities Seize $28 Million from Crypto ATM's in 35 Locations...,Negative,0.3361,1 stars,https://www.globalcryptopress.com/2024/08/german-authorities-seize-28-million.html
2024-08-05,GlobalCryptoPress,Full Speech: Donald Trump at Nashville Bitcoin Conference...,Negative,0.2229,2 stars,https://www.globalcryptopress.com/2024/08/full-speech-donald-trump-at-nashville.html
2024-07-23,GlobalCryptoPress,Ethereum ETFs  - Why This is Different Than Bitcoin ETF's...,Negative,0.236,2 stars,https://www.globalcryptopress.com/2024/07/ethereum-etfs-launch-today-why-this-is.html
2024-07-11,GlobalCryptoPress,JPMorgan Analysts Sees Signs of a BULL MARKET Approaching - Prepare for a 'Bounce Back' From August Onwards...,Negative,0.2821,2 stars,https://www.globalcryptopress.com/2024/07/jpmorgan-analysts-sees-signs-of-bull.html
2024-06-25,GlobalCryptoPress,"FTX Users To Receive 112% BACK,  FTX Claims BILLIONS MORE ""Left Over""...",Negative,0.2563,2 stars,https://www.globalcryptopress.com/2024/06/ftx-users-to-receive-112-back-ftx.html
2024-06-12,GlobalCryptoPress,"""Crypto Queen"" Stole $4.5 BILLION, then Disappeared - Why Some Are Saying She's DEAD...",Negative,0.3281,3 stars,https://www.globalcryptopress.com/2024/06/the-crypto-queen-stole-45-billion-then.html
2024-06-09,GlobalCryptoPress,"Trump Says He's the ""Crypto President""...",Negative,0.2456,1 stars,https://www.globalcryptopress.com/2024/06/trump-says-hes-crypto-president-as.html
2024-05-21,GlobalCryptoPress,"UK Courts Have Had ENOUGH Of Craig Wright - Judge Closes Case, Says Wright's Evidence 'Fabricated'...",Negative,0.2623,1 stars,https://www.globalcryptopress.com/2024/05/uk-courts-have-had-enough-of-craig.html
2024-05-14,GlobalCryptoPress,Coinbase Back Online - Unplanned Outage Lasted 4+ Hours...,Negative,0.2636,1 stars,https://www.globalcryptopress.com/2024/05/coinbase-down-cause-unknown-for.html
2024-05-06,GlobalCryptoPress,"Four ""Heavyweights"" in Finance Debate: Bitcoin VS Gold - Which One Will The Future Favor?",Negative,0.2306,2 stars,https://www.globalcryptopress.com/2024/05/four-heavyweights-in-finance-debate.html
2024-05-02,GlobalCryptoPress,This Decentralized Crypto Exchange PAYS You 90% Of Your Trading Fees BACK - BiSwap Review...,Negative,0.2355,2 stars,https://www.globalcryptopress.com/2022/02/this-decentralized-crypto-exchange-pays.html
2024-04-29,GlobalCryptoPress,"The Case for Bitcoin Crossing $100,000 in the Next 12 Months...",Negative,0.3299,5 stars,https://www.globalcryptopress.com/2024/04/the-case-for-bitcoin-crossing-100000-in.html
2024-04-14,GlobalCryptoPress,How Geopolitical Tensions Effect Maekets...,Negative,0.4904,1 stars,https://www.globalcryptopress.com/2024/04/bitcoin-takes-hit-as-geopolitical.html
2024-04-10,GlobalCryptoPress,Bitcoin ETFs May Soon Go Live in CHINA via Hong Kong - Bitcoin's Next Potential BIG BOOM that Most Don't Know is Coming...,Negative,0.2869,2 stars,https://www.globalcryptopress.com/2024/04/bitcoin-etfs-may-soon-go-live-in-china.html
2024-03-31,GlobalCryptoPress,Sam Bankman-Fried in 'EXTREME DANGER' of Violence in Prison...,Negative,0.2567,2 stars,https://www.globalcryptopress.com/2024/03/sam-bankman-fried-in-extreme-danger-of.html
2024-03-20,GlobalCryptoPress,"""I Bought my Bitcoin for a Little Under $9000... YESTERDAY""",Negative,0.2508,2 stars,https://www.globalcryptopress.com/2024/03/i-bought-my-bitcoin-for-little-under.html
2024-03-06,GlobalCryptoPress,Tether Reaches a New High of 100 BILLION USDT Coins in Circulation...,Negative,0.2422,2 stars,https://www.globalcryptopress.com/2024/03/tether-reaches-new-high-of-100-billion.html
2024-03-03,GlobalCryptoPress,"Over 1000 Mountain Gorillas in the Congo Are Now Safe, Thanks To... CRYPTO MINERS?!",Negative,0.2596,4 stars,https://www.globalcryptopress.com/2024/03/over-1000-mountain-gorillas-in-congo.html
2024-02-26,GlobalCryptoPress,"Ethereum ETF Is Coming ""Not A Matter of If, But WHEN."" Says Grayscale CEO...",Negative,0.2354,2 stars,https://www.globalcryptopress.com/2024/02/ethereum-etf-is-coming-not-matter-of-if.html
2024-02-16,GlobalCryptoPress,"The WORLD's LARGEST Bitcoin Mine Begins Construction in Texas, USA...",Negative,0.2526,1 stars,https://www.globalcryptopress.com/2024/02/the-worlds-largest-bitcoin-mine-begins.html
2024-02-02,GlobalCryptoPress,Celsius Bankruptcy Process Complete - Over $3 BILLION Begins to be Distributed to Former Users...,Negative,0.4905,1 stars,https://www.globalcryptopress.com/2024/02/celsius-bankruptcy-process-complete.html
2024-01-25,GlobalCryptoPress,Ethereum ETFs Next to Be Approved?,Negative,0.2344,2 stars,https://www.globalcryptopress.com/2024/01/ethereum-etfs-next-to-be-approved.html
2024-09-04,LiveBitcoin News,Arthur Hayes Predicts Bitcoin May Fall to $50K in Worst Case,Negative,0.3033,1 stars,https://www.livebitcoinnews.com/arthur-hayes-predicts-bitcoin-may-fall-to-50k-in-worst-case/
2024-09-04,LiveBitcoin News,Bitcoin to Face Critical September After 8.75% Drop in August,Negative,0.2851,2 stars,https://www.livebitcoinnews.com/bitcoin-to-face-critical-september-after-8-75-drop-in-august/
2024-09-04,LiveBitcoin News,FBI Warns Cryptocurrency Firms of North Korean Social Engineering Attacks,Negative,0.2793,1 stars,https://www.livebitcoinnews.com/fbi-warns-cryptocurrency-firms-of-north-korean-social-engineering-attacks/
2024-09-04,LiveBitcoin News,Former Mt.Gox CEO’s New Crypto Exchange Set to Launch This Month With ‘Transparency’ Focus,Negative,0.3576,4 stars,https://www.livebitcoinnews.com/former-mt-gox-ceos-new-crypto-exchange-set-to-launch-this-month-with-transparency-focus/
2024-09-04,LiveBitcoin News,Matter Labs Shrinks Workforce by 16% as Zksync Shifts Its Strategy,Negative,0.285,4 stars,https://www.livebitcoinnews.com/matter-labs-shrinks-workforce-by-16-as-zksync-shifts-its-strategy/
2024-09-04,LiveBitcoin News,Ripple’s CEO Announces Upcoming Launch of RLUSD Stablecoin,Negative,0.2441,2 stars,https://www.livebitcoinnews.com/ripples-ceo-announces-upcoming-launch-of-rlusd-stablecoin/
2024-09-04,LiveBitcoin News,Nexo Reopens UK Operations with Enhanced Compliance and Client Education,Negative,0.2708,2 stars,https://www.livebitcoinnews.com/nexo-reopens-uk-operations-with-enhanced-compliance-and-client-education/
2024-09-04,LiveBitcoin News,Penpie Hacker Who Stole $27 Million Funneled Over $7 Million Via Tornado Cash in 12 Hours,Positive,0.5646,1 stars,https://www.livebitcoinnews.com/penpie-hacker-who-stole-27-million-funneled-over-7-million-via-tornado-cash-in-12-hours/
2024-09-04,LiveBitcoin News,Justin Sun Implements 100% On-Chain Buyback and Burn Mechanism for SunPump,Negative,0.2737,4 stars,https://www.livebitcoinnews.com/justin-sun-implements-100-on-chain-buyback-and-burn-mechanism-for-sunpump/
2024-09-05,NewsBTC,Senator Lummis Claims Bitcoin Could Cut National Debt In Half By 2045,Negative,0.2835,4 stars,https://www.newsbtc.com/bitcoin-news/senator-lummis-claims-bitcoin-could-cut-national-debt-in-half-by-2045/
2024-09-05,NewsBTC,XRP Price To $8: Analyst Says Repeat Of 2017 Could Drive Rally,Negative,0.3743,1 stars,https://www.newsbtc.com/analysis/xrp/xrp-price-to-8-2017-rally/
2024-09-04,NewsBTC,Investors Lose Sight Of MATIC As It Drops 16% Ahead Of Network Upgrade,Negative,0.449,2 stars,https://www.newsbtc.com/news/investors-lose-sight-of-matic-as-it-drops-16-ahead-of-network-upgrade/
2024-09-04,NewsBTC,Bitcoin Boom Over? Expert Calculates How High It Can Go In 10 Years,Negative,0.3618,2 stars,https://www.newsbtc.com/news/bitcoin/bitcoin-boom-over-how-high-in-10-years/
2024-09-04,NewsBTC,"Bitcoin Short-Term Holder Behavior Reminiscent Of 2019 As BTC Remains Below $60,000",Negative,0.286,2 stars,https://www.newsbtc.com/news/bitcoin/bitcoin-2019-below-60000/
2024-09-04,NewsBTC,Is Chainlink (LINK) Sliding To $9? On-Chain Metrics Expose Weak Network Activity,Negative,0.318,3 stars,https://www.newsbtc.com/news/chainlink/is-chainlink-link-sliding-to-9-on-chain-metrics-expose-weak-network-activity/
2024-09-04,NewsBTC,"Bitcoin Bearish Move: Indicators Suggest Next Stop Could Be $53,541",Negative,0.3067,2 stars,https://www.newsbtc.com/analysis/btc/indicators-suggest-bitcoin-next-stop-could-be-53541/
2024-09-04,NewsBTC,Cardano Price Prediction: ADA Investors Add New Mpeppe (MPEPE) Token To Holdings,Negative,0.4443,4 stars,https://www.newsbtc.com/altcoin/cardano-price-prediction-ada-investors-add-new-mpeppe-mpepe-token-to-holdings/
2024-09-04,NewsBTC,Binance Whales Favor Mpeppe (MPEPE) Over BNB For 1000% Profits Towards The End Of 2024,Negative,0.4217,4 stars,https://www.newsbtc.com/altcoin/binance-whales-favor-mpeppe-mpepe-over-bnb-for-1000-profits-towards-the-end-of-2024/
2024-09-04,NewsBTC,BNB Price Analysis: Binance Holders Add New Gambling Token For 100X Profits,Negative,0.3599,4 stars,https://www.newsbtc.com/altcoin/bnb-price-analysis-binance-holders-add-new-gambling-token-for-100x-profits/
2024-09-04,Nultx,"BlockDAG Teams Up with Inter Milan, Capturing Bitcoin Cash Investors’ Focus; Latest Updates on TRON Coin",Negative,0.2812,4 stars,https://nulltx.com/blockdag-teams-up-with-inter-milan-capturing-bitcoin-cash-investors-focus-latest-updates-on-tron-coin/
2024-09-04,Nultx,"Utility Crypto To Buy For 2024 Bull Run: Toncoin (TON), ETFSwap (ETFS), And Cardano (ADA)",Negative,0.3409,4 stars,https://nulltx.com/utility-crypto-to-buy-for-2024-bull-run-toncoin-ton-etfswap-etfs-and-cardano-ada/
2024-09-04,Nultx,PEPE Bulls Take Action With WIF Rallying Strong Above $1.5; DTX Presale Moves Ahead With $2.2M Secured,Negative,0.2979,4 stars,https://nulltx.com/pepe-bulls-take-action-with-wif-rallying-strong-above-1-5-dtx-presale-moves-ahead-with-2-2m-secured/
2024-09-04,Nultx,Fetch.AI (FET) On-Chain Activity Shows Growing Investor Confidence Amid Price Fluctuations,Negative,0.3119,2 stars,https://nulltx.com/fetch-ai-fet-on-chain-activity-shows-growing-investor-confidence-amid-price-fluctuations/
2024-09-04,Nultx,The Rise Of DeFi Blue-Chip Tokens: A Strong Market Presence And Investor Interest,Negative,0.3188,4 stars,https://nulltx.com/the-rise-of-defi-blue-chip-tokens-a-strong-market-presence-and-investor-interest/
2024-09-04,Nultx,"TRON Network Sees Surge In Activity, Leading Blockchain Revenue In August",Negative,0.3602,4 stars,https://nulltx.com/tron-network-sees-surge-in-activity-leading-blockchain-revenue-in-august/
2024-09-04,Nultx,TON Blockchain Surpasses 1 Billion Transactions Following Successful USDT Integration,Negative,0.3599,4 stars,https://nulltx.com/ton-blockchain-surpasses-1-billion-transactions-following-successful-usdt-integration/
2024-09-04,Nultx,"SunPump Token Adopts 100% On-Chain Buyback And Burn, Outpaces Solana Rival Pump•fun",Negative,0.3426,4 stars,https://nulltx.com/sunpump-token-adopts-100-on-chain-buyback-and-burn-outpaces-solana-rival-pumpfun/
2024-09-04,Nultx,Cumulative Daily DEX Volume Hits 2024 Low As Solana Leads In Active Addresses,Negative,0.2967,2 stars,https://nulltx.com/cumulative-daily-dex-volume-hits-2024-low-as-solana-leads-in-active-addresses/
2024-09-04,Nultx,"$VISTA Coin Surges 435x, Redefines Ethereum Token Launches With Focus On Security And Fairness",Negative,0.3552,1 stars,https://nulltx.com/vista-coin-surges-435x-redefines-ethereum-token-launches-with-focus-on-security-and-fairness/
2024-09-04,SF-Today,"Aditya Ultra Steel IPO Date, Price, Allotment Details and More",Negative,0.2397,3 stars,https://sfctoday.com/aditya-ultra-steel-ipo-date-price-allotment-details-and-more/
2024-09-04,SF-Today,"Stock Market Updates Sep 4th: Sensex down 450+ Pts, Nifty at 25,083 – Top Losers Next Possible Targets",Negative,0.3733,1 stars,https://sfctoday.com/stock-market-updates-sep-4th-sensex-down-450-pts-nifty-at-25083-top-losers-next-possible-targets/
2024-09-04,SF-Today,Crypto Firms on High Alert After FBI Warning of New Attacks,Negative,0.279,4 stars,https://sfctoday.com/crypto-firms-on-high-alert-after-fbi-warning-of-new-attacks/
2024-09-04,SF-Today,The Psychology of FOMO in Crypto Markets,Negative,0.3363,4 stars,https://sfctoday.com/the-psychology-of-fomo-in-crypto-markets/
2024-09-04,SF-Today,True Cost of Crypto Mining on the Environment,Negative,0.3886,4 stars,https://sfctoday.com/true-cost-of-crypto-mining-on-the-environment/
2024-09-04,SF-Today,"Crypto Price Today: Bitcoin at US$56K, Ethereum and Other Top Coins See Declines",Negative,0.3101,4 stars,https://sfctoday.com/crypto-price-today-bitcoin-at-us56k-ethereum-and-other-top-coins-see-declines/
2024-09-04,SF-Today,IPO Plans: HDB Financial Taps International Banks,Negative,0.3229,4 stars,https://sfctoday.com/ipo-plans-hdb-financial-taps-international-banks/
2024-09-04,SF-Today,ICOs vs IEOs vs STOs: What’s the Difference and Which is Better?,Negative,0.3942,4 stars,https://sfctoday.com/icos-vs-ieos-vs-stos-whats-the-difference-and-which-is-better/
2024-09-04,SF-Today,"Shree Tirupati Balajee Agro Trading IPO Date, Price, Allotment Details and More",Negative,0.2328,4 stars,https://sfctoday.com/shree-tirupati-balajee-agro-trading-ipo-date-price-allotment-details-and-more/
2024-09-03,SF-Today,"My Mudra Fincorp IPO Date, Price, Allotment Details and More",Negative,0.2507,3 stars,https://sfctoday.com/my-mudra-fincorp-ipo-date-price-allotment-details-and-more/
2024-09-04,The Crypto Basic,"Meme Coin Alert! Investors Rush To Snap Up Raboo Presale, Outshining Dogwifhat And Pepe",Negative,0.2637,1 stars,https://thecryptobasic.com/2024/09/04/meme-coin-alert-investors-rush-to-snap-up-raboo-presale-outshining-dogwifhat-and-pepe/?utm_source=rss&utm_medium=rss&utm_campaign=meme-coin-alert-investors-rush-to-snap-up-raboo-presale-outshining-dogwifhat-and-pepe
2024-09-04,The Crypto Basic,Venga’s User-Friendly Crypto App Launches To Vanquish Blockchain’s Complexity Forever,Negative,0.2307,4 stars,https://thecryptobasic.com/2024/09/04/vengas-user-friendly-crypto-app-launches-to-vanquish-blockchains-complexity-forever/?utm_source=rss&utm_medium=rss&utm_campaign=vengas-user-friendly-crypto-app-launches-to-vanquish-blockchains-complexity-forever
